{
  "schema_version": "1",
  "case_id": "032",
  "state": "constructed",
  "finalization_allowed": true,
  "scoring_required": [
    { "path": "result.json", "role": "scoring_required" },
    { "kind": "ref", "path": "trajectories[].path", "role": "scoring_required" },
    { "path": "md/pilot_350K.traj", "role": "scoring_required" },
    { "path": "order_parameter.csv", "role": "scoring_required" },
    { "path": "curie_temperature.png", "role": "scoring_required" },
    { "path": "report.md", "role": "scoring_required" }
  ],
  "reproduction_required": [
    { "path": "run_profiles.json", "role": "reproduction_required" }
  ]
}
