{
  "schema_version": "1",
  "case_id": "033",
  "state": "constructed",
  "finalization_allowed": true,
  "scoring_required": [
    { "path": "result.json", "role": "scoring_required" },
    { "path": "teacher_model.pb", "role": "scoring_required" },
    { "kind": "ref", "path": "history[].trajectory", "role": "scoring_required" },
    { "path": "best_trajectory.traj", "role": "scoring_required" },
    { "path": "search_history.csv", "role": "scoring_required" },
    { "path": "domino_analysis.csv", "role": "scoring_required" },
    { "path": "search_results.png", "role": "scoring_required" }
  ],
  "reproduction_required": [
    { "path": "run_profiles.json", "role": "reproduction_required" }
  ]
}
